{
  "schemaVersion": "2.0",
  "scenarioId": "state-only-smoke",
  "name": "State-only smoke",
  "priority": "P1",
  "tags": [
    "smoke",
    "state"
  ],
  "preconditions": [
    "fixture:default-workspace"
  ],
  "steps": [
    {
      "index": 1,
      "action": "command.execute",
      "target": {
        "command": "setState",
        "stateKey": "sessionReady"
      },
      "input": true,
      "assertions": [
        {
          "type": "host.outcome",
          "source": {
            "stateKey": "sessionReady"
          },
          "expected": true
        }
      ]
    }
  ]
}
